"[npm] Clean up package content","Currently npm packages contains folders like `.github`, and files like `.appveyor.yml` and `.travis.yml`. Those are probbably not useful in a package context, so should be excluded (if possible).## Implementation Progress### Platforms- [ ] cordova-android- [ ] cordova-browser- [x] cordova-electron (https://github.com/apache/cordova-electron/pull/10)- [ ] cordova-ios- [ ] cordova-osx- [ ] cordova-test-platform- [ ] cordova-windows### Plugins- [ ] cordova-plugin-battery-status- [ ] cordova-plugin-camera- [ ] cordova-plugin-device- [ ] cordova-plugin-dialogs- [ ] cordova-plugin-file- [ ] cordova-plugin-geolocation- [ ] cordova-plugin-inappbrowser- [ ] cordova-plugin-media- [ ] cordova-plugin-media-capture- [ ] cordova-plugin-network-information- [ ] cordova-plugin-screen-orientation- [ ] cordova-plugin-splashscreen- [ ] cordova-plugin-statusbar- [ ] cordova-plugin-vibration- [ ] cordova-plugin-whitelist- [ ] cordova-plugin-wkwebview-engine### Tooling- [ ] cordova-app-hello-world- [ ] cordova-cli- [ ] cordova-coho- [x] cordova-common (https://github.com/apache/cordova-common/pull/104)- [x] cordova-create (https://github.com/apache/cordova-create/pull/50)- [ ] cordova-docs- [x] cordova-fetch (https://github.com/apache/cordova-fetch/pull/74)- [ ] cordova-js- [x] cordova-lib (https://github.com/apache/cordova-lib/pull/809)- [ ] cordova-mobile-spec- [ ] cordova-node-xcode- [ ] cordova-paramedic- [ ] cordova-plugin-test-framework- [ ] cordova-plugman- [ ] cordova-serve_Excluded: `cordova-status`, `cordova`, and any unused, outdated, or deprecated repos_","open","113","undefined","[object Object]","null"
"[npm] Clean up dist-tags","I noticed that the dist-tags of our npm packages sometimes have old stuff that could/should be removed:https://www.npmjs.com/package/cordova-windows```    3.5.0	3.5.0    7.0.0	latest    3.6.3	rc    7.1.0-nightly.2019.5.24.b950b256	nightly```Both `rc` and `3.5.0` should probably be deleted here.","open","112","undefined","","null"
"Migrate Information from config.xml to package.json","# Feature Request## Motivation Behind Feature<!-- Why should this feature be implemented? What problem does it solve? -->Currently, we have been in the process of trying to migrate some information from `config.xml` to `package.json` file. I believe, there's more information that can be moved over. For example, the information in the `author` tag, like author name, email, website URL. Moving this information straight to the `package.json` would allow us to clean up `ConfigParser`.","open","110","undefined","","null"
"[Plugins] Add Table of Contents to README","When cleaning up the README of cordova-plugin-splashscreen I also added a TOC at the beginning: https://github.com/apache/cordova-plugin-splashscreenI think all plugin READMEs would benefit from have a table of contents.","open","107","undefined","[object Object],[object Object]","null"
"CLI: Faster workflow for iterating on plugin configuration and JS","Current one needs to remove and re-add a plugin each time you edit anything on the plugin configuration (package.json, plugin.xml etc) or the JS implementation in `www`. This takes quite a lot of time and is error prone.`--link` should help for the native parts, so we need something similar to that but for the other parts of the plugin.","open","101","undefined","[object Object]","null"
"Loading cordova.js in a web worker and use a bluetooth plugin to process in a different thread","# Loading cordova.js in a web worker and use a bluetooth plugin to process in a different threadHi! I'm trying to connect a bluetooth printer and say "Hello". I'm using **cordova-plugin-bluetooth-serial**.The main problem is because a worker can't manipulate the DOM or windows, so the console show the next error when execute the command **cordova run android --device**:    cordova.js:2184 Uncaught ReferenceError: window is not defined    at cordova.js:2184    at cordova.js:2189    at demo_workers.js:1Is there a way to load cordova.js in a worker and be able to load plugins to work isolated from the main thread?# Code to replicate the situation:## package json:**package.json**     {    "name": "com.test",    "displayName": "test",    "version": "1.0.0",    "description": "A sample Apache Cordova application.",    "main": "index.js",    "scripts": {    "test": "echo \"Error: no test specified\" && exit 1"    },    "author": "Apache Cordova Team",    "license": "Apache-2.0",    "dependencies": {    "cordova-android": "^7.1.4",    "cordova-plugin-bluetooth-serial": "^0.4.7",    "cordova-plugin-whitelist": "^1.3.3"    },    "cordova": {    "plugins": {    "cordova-plugin-whitelist": {},    "cordova-plugin-bluetooth-serial": {}    },    "platforms": ["android"]    }    }## /www files:**index.html**    <!DOCTYPE  html>    <html>    <script  type="text/javascript"  src="setupWorker.js"></script>    <script  type="text/javascript">	    function  print() {		    w.postMessage("Hello");	    }    </script>    <body>	    <button  onclick="print()">print</button>	    <div  id="statusDiv"></div>    </body>    </html>**setupWorker.js**    var  w;    function  startWorker() {	    if (typeof  Worker  !==  "undefined") {		    if (typeof  w  ==  "undefined") {			    w  =  new  Worker("demo_workers.js");		    }	    } else {		    document.getElementById("statusDiv").innerHTML  =		    "Sorry! No Web Worker support.";	    }    }    startWorker();**demo_workers.js**    importScripts("cordova.js");    importScripts("bluetooth.js");          app.initialize();     onmessage  =  function(e) {    	app.onMessage(e.data);    };**bluetooth.js**    var  macAddress  =  "00:00:00:00:00:00";        var  app  = {	    initialize:  function() {		    this.bindEvents();	    },	    bindEvents:  function() {		    self.addEventListener("deviceready", this.onDeviceReady, false);	    },	    onDeviceReady:  function() {		    bluetoothSerial.connect(macAddress, app.onConnect, app.onDisconnect);	    },	    onConnect:  function() {		    console.log("Connected to "  +  macAddress  +  ".");		    bluetoothSerial.subscribe("\n", app.onMessage, app.subscribeFailed);	    },	    onDisconnect:  function() {		    console.log("Disconnected.");	    },	    onMessage:  function(data) {		    bluetoothSerial.write(			    data,			    () => { console.log("write succsess");},			    () => {console.log("write dailure");}		    );	    },	    subscribeFailed:  function() {		    console.log("subscribeFailed...");	    }    };","open","93","undefined","[object Object]","null"
"Add OGX.JS as Framework","# Feature Request## Motivation Behind Feature<!-- Why should this feature be implemented? What problem does it solve? -->New JavaScript framework for Cordova - Please add a link from homepage## Feature Description<!-- Describe your feature request in detailPlease provide any code examples or screenshots of what this feature would look likeAre there any drawbacks? Will this break anything for existing users? -->Please add link from Cordova site homepage to https://github.com/globules-io/OGX.JS/wiki**Logos can be found here:**Color : https://drive.google.com/file/d/1NYWktWlilxIxjvXs65iYGsrLMGkW44di/view?usp=sharingB&W : https://drive.google.com/file/d/1Q4cWBwR0C33_mWzq957k413MN04h4Fpb/view?usp=sharing**Description:**OGX.JS is a JavaScript framework to rapidly create mobile (Android, iOS), desktop (Android ChromeOS) and web applications.","open","92","undefined","[object Object]","null"
"Add Node 12 & Drop Node 6 & 8 Support","# Feature RequestI would like to start discussing and planning for:- Dropping `Node 6` Support- Dropping `Node 8` Support- Adding `Node 12` Support## Motivation Behind FeatureThe Node team currently has documented: - Node 6's End of Life: 2019-04-30- Node 8's End of Life: Targeted date December 2019- Node 12's Initial Release: Targeted date April 23rd 2019You can read more about Node's release schedule [here](https://github.com/nodejs/Release).## Feature Description- [x] Public Announcement via Blog Post### **May 2019?**- [x] Update AppVeyor/Travis CI to test with Node.js 6.x, 8.x, 10.x, and 12.x.- [x] Update requirement check and notify users of Node.js 6.x deprecation. https://github.com/apache/cordova-cli/pull/454### **Fall 2019**- [x] Update requirement check and notify users of Node.js 8.x deprecation. https://github.com/apache/cordova-cli/pull/458### **Winter 2019**- [ ] Removed Node.js 6.x support.- [ ] Removed Node.js 8.x support.- [ ] Added Node.js 12.x  support.- [ ] Platforms, tools, and core libraries to bump up a major version.- [ ] Update AppVeyor/Travis CI to test only Node.js 10.x, and 12.x.## Alternatives or Workarounds- Undefined","open","79","undefined","[object Object]","null"
"Feedback about the new GitHub issue and PR templates","As the new GitHub issue and PR templates are rolled out, I think it makes sense to start collecting feedbacks and things we notive about them ourselves to be able to iterate and improve them.","open","78","undefined","[object Object]","null"
"Unsuccessful cordova platform/plugin commands","I looked a bit at the Cordova Telemetry data about the commands executed:[datastudio.google.com/reporting/0B-Ja5cNOX_XLTElHdWd4V2NUem8/page/zkJF](https://datastudio.google.com/reporting/0B-Ja5cNOX_XLTElHdWd4V2NUem8/page/zkJF)After creating #75 and #74 the only big "class" of `unsuccessful` commands left were related to `platform` and `plugin`:![image](https://user-images.githubusercontent.com/183673/52914620-0c711c00-32cb-11e9-8407-95de03b83f08.png)![image](https://user-images.githubusercontent.com/183673/52914636-27439080-32cb-11e9-8765-6ff8c4af0f79.png)Lots of unsuccessful there as well. Going through the list you also notice that there are some that are not actually valid commands (`cordova platform android`) which still are counted as successful as they are mapped to another (not really wanted) command internally.Looking at _all_ unsuccessfull command executions, the platform/build related ones account for 38% commands.Why are so many `add` and `remove` failing? Typos of the users?","open","76","undefined","[object Object]","null"
